1,in theory how could u apply e=mc^2 to a machin that produces energy? like what sort of actions and reactions would need to take place for somthing like this to work. Cf: atomic bombs and nuclear power plants. They use the conversion of a tiny amount of mass to lots and lots of energy.
1,I dont know the answer to this word problem....? Six roles are being cast at a school play. Fifteen students show up for audtions. The question i need to know is how many different casts are possible? there are 6 place for 15 student so:-\n\n15*14*13*12*11*10=answer\n\nor simply use combination since the arrangement is not important\n\n15C6
1,Where may I find data of unemployment rates in the US? sites would be aweomse. www.bls.gov that is the Bureau Of Labor Statistics Website
1,"hey ppl.i have a doubt in physics? we all know the formulae for gravity at an altitude...g(1-2h/r),now if the height is 3200 kms,then gravity at that point becomes 0(as radius of earth=6400kms)..,,..but this is nt possible practially ...gravity never becomes 0 at any height...so,is the formulae wrong? Yes it is wrong.  It might be a good approximation for lower altitudes, but is not truly correct.  In the same way, Newton was wrong with his equations, but they still make good approximations over reasonable ranges of values."
1,"how can i learn about calculus and advanced mathematics step by step ? Recomendations. however i have some algebra and calculus How about the ""For Dummies series?""  The books are actually pretty helpful and they do take great lengths to explain things in a precise manner that is easy to understand.  I have used this series to teach myself certain programming languages before moving on the more in-depth books."
1,"""why do water pipes burst in very cold water""? it must be 50 words or more Write your own essay...but water freezes when it is cold and becomes ice which expands causing the pipes to burst, that's why they need lagging/insulating to prevent this happening."
1,"How to produce hydrogen from seaweed? PROCESS If you ferment the biomass it will make methane. The remove the hydrogen from the methane? If you meant seawater, electrolysis will give you hydrogen and oxygen. A lot was manufactored in Norway since they had hydroelectricity to use."
1,"simultaneous equations? if, \nax+by= c, \nax+by=c, \n\ncan a or b ever be 0 ?\nin other words, can you ever have a 0 number of variables? Of course you can... if a = 0, you have an equation that would simplify to:\n\nby = c\ny = c/b  (and since c and b are constants)\ny = d\n\nwhich would represent a horizontal line crossing the y axis at d\n\n\nSame with b, only if b = 0 you would have a horizontal line"
1,"who provides courses on signals analysis? including cw and various modulations? I'd like to learn how to analyze signal waveforms, including cw waveforms and pulse waveforms with different types of RF and phase modulations. If I understand your question correctly, this is a standard 3rd year course in most Canadian Universities offering a Bachelor of Applied Science in Electrical Engineering."
1,"I want some information about frogs. Can anyone help? I know you get blue frogs and poisonous frogs, etc. I want to know if ALL blue frogs are poisonous and if a frog has spots, does that mean it is poisonous? ""Learn all sorts of true, weird and wacky facts about frogs and toads!""\nI've included the link for Poisonous frogs"
1,"you wont be able to answer this, it's hard? ok there is this family with 2 children and 2 parents, both parents are 100kg each and both kids are 50kg each. they need to get across a river with one boat. but the problem is the boat can only hold 100kg per time, how did the ALL the family get to the other side Two kids go across, one kid comes back, one parent goes across, kid goes back, two kids go over, one kid goes back, one parent goes over, one kid goes over, two kids go acroos, THE FAMILY IS ACROSS!"
1,Does anyone know if a any of these psionic gadgets are actually real? If anyone out there has ever used any of the items on this page http://www.futurehorizons.net/psi.htm\nplease give me your input. Mainly the first two items. Thanks. It's real but don't know how and if they work.
1,Osmosis is based upon:? a. All of these choices. \nb. Tonicity. \nc. Differential pressure. \nd. Concentration. a.
1,earth science? identify the scetch in the scientific method do you mean the basic idea problem hypothesis experiment results conclusion
1,"What is 2+28-65+48+99,002,456,486+1-87-998? What is 2+28-65+48+99,002,456,486+1-87-998 2 +28 -65 +48 +99,002,456,486 +1 -87 -998\n= 99,002,455,415\nNote to other answerers:  If you hold your mouse over the string of characters, it will show everything."
1,"if aerogel were made in a total vacume or in space, would it implode, float or just act normal*? if it would be exposed to athmosheric pressure a sea level, and what would happen when held underwater? It is fragile as all get out.\nhttp://eande.lbl.gov/ECS/aerogels/satoc.htm\nThey are filled under presure.\n\nOriginally it was used in screwworm medicine for sheep as well as a thickener for house paint."
7,"In the stage show Mamma Mia which character is Rosie? A friend of mine is due to start as Rosie in Manchester tomorrow and I can't remeber which character Rosie is, is it one of the mother's friends or one of the daughter's ? Rosie is the tomboy member of the band the mother was in years ago."
7,"Does Katherine McPhee have enough booty to beat Taylor's skillful finale? MAN she is fine, but will her fine physical attributes overthrow the obvious victory in the finale by Taylor?  SOUL PATROL! No way! Taylor is a bit more unique and original than McPhee, something the entertainment world needs more of. We don't need another cookie-cutter pretty face."
7,"Teen People, J-14, or Seventeen? Teen People all the way. I owned 5 Teen People magazines using subsription. I only read J-14 and Seventeen at grocery stores and in the classroom either new or old issues. So, what's yours? ahh definitely seventeen. J-14 is horrible, but teen people is good too. I love seventeen though cuz it has so many different elements too it, i just find it most entertaining"
7,"what is the song w/  ""and she haaaaas the mooooost....beauuuutiful face (smile?)"" in the lyrics? name of song or artist plz, i don't even know if those are the exacpt lyrics which is proving very dificult to find the song, its a classic and very soothing in a smooth, light voice (if that helps) ""Do You Realize"" by The Flaming Lips"
7,"Why did SKY buy LOST? I know this had already been discussed, but how unfair is it that SKY have got LOST series 3 in the UK.  Is series 3 the last one...... because they are evil money sucking fiends and i hate them! this is third time they've done this to me! first they took 24, then they took nip tuck, but now this?!?!\ni hate them, i hate them, i hate them!!"
7,"1980's song title and group name, please.? I'm sorry but I was just thinking of the right words to say.\nI know they don't sound the way I planned them to be.\nBut if I could just walk the world, I'd make you fall for me,\nI promise you, I promise you, I will. The Promise by When in Rome"
7,Why is it that Jeff Probst from Survivor keeps asking me for tiki torches?? Doesn't CBS have enough money to pay for more of their own?? He just uses that as an excuse to see you.... he has a crush on you.
7,"Is ""The Scientist"" by coldplay your favourite song? Mine too, but which is your 2nd favourite? nah i'm more of a..well, not a coldplay fan at all. sorry pal."
7,"What weighs more 100 lbs. feathers or 100 lbs. of gold? I know it might be easy for some...but watch some humours answers. You think you have an exaulting presence, don't you.  The answer is YOU weigh, Feathers."
7,"What happend to Aqua? Does anyone remember Aqua.\nThey played Barbie Girl, Candy Man, ECT.\n\nI remember they live in Belgium, and They are Soren, Rene, Lene, or something?\n\nANY INFO OR BIO ON THEM? Hi\n\nthey've not been a band since 2001!!!\nthe link below gives their last statement and full bio etc !!!\n\nHope i helped"
7,"Any real punks out there?Into punk rock? check out this band and tell me what you think please    myspace.com/homelessjoekidfister you should make a link. chances are I'll think this band is awsome. p.s... i love fall out boy, taking back sunday, the used and more!!!!!!! lol"
7,"abt the stage performances of rock bands? man how do they perform??? do they perform on dope, or is it pure raw stamina that drives them. wht is it, wanna know.. drunk and high most of time"
7,"What do you think of my latest poll on my 360? Do you have any feedback about my 360? Looks good, love the choice of colors."
7,what do you think about Benji Madden dating Sophie Monk? I think...*puts finger in mouth and chokes* YUCK!!! And so unattractive that he Smokes...! eww...and its so nasty...\never since he started dating her...he change...and that change is NOT good.\nSorry but u know i care cuz he's my favourite Celeb...but I HATE his girlfriend...she's setting and giving him negativitiy. And i don't like what she is doing to him. Hes a very very very very very very very lucky guy!
7,"How many of you girls think Channing Tatum is totally fit? And do you think he is totally straight (we can only hope!) Totally, totally, totally...\nMMMMMMMMM-MMMMMMMMMMMMMMMMMMMMMMMMMMMMMMMMM........ :-)"
7,"Are the creators of South Park Jealous of Family Guy? They claims that the show’s jokes, often absurd, out-of-continuity cutaways, are interchangeable and have nothing to do with the plot. But isn't that why we like it? I think so, South Park is running out of jokes and things to make fun of."
8,"""id rather you be mean than love and lie...""agree?disagree? from the song baby dont break my heart slow - vonda shephard that's exactly what i think but most people don't get it ever"
8,"Dating and Race? When it comes to white men and black men is there like a different way that they go about apporoaching dating. I heard that for example with white men usually they expect the woman to take the innitiative with things, for example phone calls and stuff ... is there like any truth to this no difference,if you like the gut no matter what race,just try,whats the worst that can happen,him saying,no thats about it.so go for it,and dont worry about race"
8,"do u like morning person better than night person.? I am a night person and morning person have no patience with me, do u have any problems with someone living with you as a morning person? I've always preferred nite.  But would rather be a day person, since I love sun and daylite."
8,how do u tell a really  hot guy that u want to go out? But he hardly even knows you but you talk occasionally.And u dont even know if he likes u or not! well first keep talking to him then when u get to know him better u will get the courage to ask him out. even if he says yes or maybe even no still keep in touch with him.
8,"Why do women always blame men? I know we're horible and we're pigs and what not...but honestly. Its not too hard to tell which guys are pigs and which guys arent. Everyone knows women can get away with a million things guys cant. Why do you blame us for everything that goes wrong? Simple, because women are taught by feminists to be independant of, and angry at men. If women were to admit their faults to men, they would become vulnerable, (in their dilusional minds). Feminists teach women to deny the intelligence, and invaluable need of men. Women who admit men can be right and women wrong are promoting the opposite."
8,"Making him feel more comfortable? heres the scoop. my boyfriend is meeting my parents tommorow. hes a sweet guy and i have no problems with him.. but how do i make him feel more comfortable? he seems really worried? have you told your parents how worried he is. that might help,so they know to go easy on him and to be nice not to crack no jokes like fathers tend to do."
8,"im 14 and this i like is 14 also. i gave him a note, asked him out and am waiting for his answer, wat now? we go to the same skool, we are 2 classes together and my friend says we make cute couple! Congratulations on making the first move. It takes guts to do that. Now you have to wait and see how he reacts. Give it some time, he may need to think. Good luck.  Hope it works out."
8,"how can i talk to you women here on yahoo? i am 13 years old and i have many friends, i masturbate 3 times a day and i am still a virgin, after i masturbate i want talk to women, you know, just to talk, just to say hi and wuts up, but i dont know where to get phone numbers. i dont want to talk to family and friends, please help me. go to school, you need to think about more important things @ 13 yrs. old!"
8,"My friend flirts with my boyfriend? The best bit is that I WAS THERE! Ughhhh! She is such a slut. He didn;t talk 2 me d whole evening, he was 2 busy flirting with her! Now, thats real trouble. How do u sit there and watch ur friend enjoy the night with ur man INFRONT of you ?? Wonna know what u should do? Have a long talk with him and tell him that u dont like the flirting bit with your friends. \nOr u wonna get nasty? Pretend to Flirt with his friends for a while, trust me, he will never LOOK at another girl.."
8,"How do you get over someone who cheated on you? My boyfriend of 3 1/2 years cheated in our own bed. Im torn apart. I walked in on it. I dont know how to move on. He is still best friends with my older brother(thats how we met). I need to forget about him.Please help. gurl i think you love him and if you do then forgive and forget and yea its gonna be hard but then again if you dont think you can do it then move on to find someone better because if he would have loved you then he wouldnt have cheated on you, so he is not to much of a boyfriend"
8,"what does it mean if a guy asks you for a happy ending? yeah...one of my guy friends asked me that today, and i said i didnt know what it meant and he told me to ask my bf. but he wouldn't tell me either To give a b-j, until he reaches orgams, and with a smile, he is happy.  A Happy ending."
8,"do you know a dating site that don,t need any credicard ,dollar ,paying ,...? in my country there isn,t credicard , visa card, paypal , checkmail , ...  there for i need a datingsite without any money              free datingsite need credicard in internet too . plentyoffish.com"
8,"(Women) Do you like your men shaved down there? Do you like when a guy has his penis and balls shaved or does it matter? What's the difference? i've never met a guy who grows hair on his penis. you should get that checked out, but in the meantime keep shaving"
8,do we use thermal energy to have sex? means heat and when you have sex you get heated up well naturally you are going to get heated up....
8,What would I need to do to get someone from the opposite sex to notice me being that I am overweight? I am 29 years old and I weigh about 275 lbs. Wear nice clothes and have a nice haircut.
8,"Any guys here pretend to be married?? Sometimes when I go out to the club, I wear a cheap wedding band I bought at Wal-Mart and I get hit on even more than when I don't have it.  It's mostly single girls, but sometimes I bring home a married woman also.  Any other guys wear fake wedding bands? no-but most girls are whores-it is that women lib stuff"
5,Where can I find a good online ice hockey dictionary? I am looking for a good online dictionary that lists all of the hockey( preferrably ice hokey) terms. here u go http://www.pyh.org/hockey_dictionary.htm
5,"What about us? How come there is not a category for body building or figure competitions??  Is snooker really a sport? I don't know, and yes."
5,Who is your favorite foot ball team (teams)? me Patriots#1  Broncos#2 TampaBay #3 last but not lest GreenBay#4 New England Patriots.
5,do you like the longhorns or  texas a&m? i vote A&M. Go Texas A&M!!!! =) Aggies rule.\nLonghorns i still like. They are kool too. Played baseball at A&M.....gig em.....whooooop !!
5,quels sont les 5 meilleurs buteurs de la ligue espagnole et leurs nombres de buts? foot et buts 1 Frédéric Kanouté 7buts Sevilla FC \n2 Diego Milito 7buts Real Zaragoza \n3 Ronaldinho 6buts FC Barcelona \n4 David Villa 5buts Valencia CF \n5 Samuel Eto'o 4buts FC Barcelona
5,Who do you think will win the UEFA Super Cup? It's the cup played between the UEFA cup winners and the UEFA Champions League winners STEAUA BUCHAREST !!!!
5,"According to ELO ratings. PORTUGAL are playing near their best. I pick them to make the Final. Do you agree? SOURCE:\nhttp://www.eloratings.net that would be a hell of a game, Portugal v. Brazil"
5,"What color was the Green Monster in Fenway Park before it was made green in 1947.? Red Sox stadium, Fenway Park has a part named the green giant, which was painted green in 1947. Hey!! Get your facts straight please. It is not called, nor has it ever been called, the ""green giant."" It is called the Green Monster, and as far as I know, it has always been green.\n\nA Red Sox fan since 1945!!"
5,"Is KENNY WALLACE your favorite Nascar celebrity ? Kenny is everyone's favorite, cuz he is so goofy and knows how to laugh at himself.  Has anyone seen Elliott Sadler's impression of Kenny (Herman) on Wind Tunnel with Dave Despain ? I like Kenny. He's funny, and he's a cool guy. He's not my favorite when it comes to racing, but he is my fave when it comes to personality!"
5,Portugal/Pays Bas : arbitrage minable+attitudes de voyous et simulations à la chaîne des Portugais...? Est-ce bien cela le SPORT ??? L'arbitre etait incapable de gérer la situation. A quand la vidéo pour sanctionner les simulateurs (meme aprés le match)
5,"Whtz wrong with Indian Cricket team selectors ??? y wasnt irfan , sreesanth  n shewag playin .  \n \ny did we evn had jaffer n dinesh mongia . \nAccordin to me the team shou;ld have been \nsachin \nshewag\nkaif\ndravid\nraina \ndhoni\nirfan \nzaheer \nharbhajan  OR Agarkar \nmunaf patel \nsreeesanth  \n\n wut du u guyz think >???????????????? I agree, your right thats all bs"
5,"Name 4 world cup debutants this year in Germany.Two must come from Africa and the other from outside Africa.? Please be precise. trinidad and tobago, ghana, togo and the ivory coast"
5,what is the steps of mini tennis? its all about the movement. inf. in this site\nhttp://www.itftennis.com/coaching/publications/nonitfpubs/science/minitennis.asp
5,what players were on the St. Louis Rams 2004 roster? nfl roster archives http://slam.canoe.ca/StatsFBP/BC-FBP-LGNS-STLOUISROS-R.html\n\ntry this site.  it is a list of the 2004 playoff team for the rams\ni think this is what you are looking for
5,what is a good site to learn how to do ballet and hip-hop dance for free on-line? i figure skate and my coach feels i need some more help. http://www.learntodance.com/online-dance-lessons.htm\n\nhope this helps.
5,who will be the first new ECW champ.....No first 3??? RVD apears to have a lock as #1???? 1. RVD who will have a semi long run with some brutal matches with Kurt Angle but will retain it and eventually drop the title to...\n2. SABU\n3. MIKE AWESOME will show up with a new gimmick out of no where and beat SABU\n\nWell its a good a guess as any Kurt Angle will definitely get it eventually though he is the most complete athlete right now but they have to build ECW up first with the old ECW wrestlers before passing any torches
0,"why does yahoo have the silly tos agreement that bans any real discussion of race.? even if discusions of race offend some , do people have a greater right to not be offended than the right of people to have and express unpopular opinions? Yahoo just wants this place to be popular. They care little about actual discussion or rights. It's just the whole nature of business in general... a business will do anything that will promote its product and it will avoid anything that will do nothing for it. \n\nRace discussions are generally highly subjective and the negative risks of such a discussion outweigh any positive gain for Yahoo. Thus, they ban it. Rights of individuals has nothing to do with it."
0,"Do you think ..........? God said that one man in the bible should circumsize his sons...  Do you think it is ok for a man that was not circumsized in the sight of God? Absolutely.  Read the letters from Paul (e.g. Romans, 1 &2 Corinthians, etc.) and you'll see that Gentiles are just as welcome and just as saved."
0,"Who cares for pigs ? I'm getting older, and maybe wiser, but do people (Men & Women) who degrade themselves by acting and talking like pigs really think someone is going to take an interest in them ? Pigs care for themselfs"
0,"What did you get in the mail today? I got an offer from Aladdin Hotel in Las Vegas for 2 nights at the special rate of $69 a night, a copy of the Pennysaver, Encino Center Car Wash coupons, an offer for Direct TV, Closet World, Cingular Phones, Papa Joe's Pizza, and an invitation to the fashion event of the summer, with coupons from Express. new hair saloon coupon, my phone bill/gosh/ and a newspaper..."
0,Did a man with Cloven Hooves appear at the Degraff Free Will Baptist Church in Ohio recently? I had about this via email. Yeah\nbut I didn't realise I was spotted
0,"Can you go to jail for this? if your a guy and just turn 18 and have sex with your girlfriend who is 17 or only 2 months younger than you can you go to jail, Or would nobody care. Nobody will care. \n\nState laws vary, but with the two individuals being so close in age, no prosecutor is going to bother."
0,"If George Dubya Claims christianity why does he Attend the Cremation of Care at Bohemian Grove? I dont want Someone who Lies about Religion Watching over our country......\n\nThis man takes part in the cremation of care.\n\nthis is where a colt sacrifices a child to there idol (molech)\n\nif u read the bible jesus said anyone who sacrifices there child to molech will be killed....\n\nmore info @ INFOWARS.com\nand Bushisantichrist.com Don't make up stories.\n Strange facts always wins, over made up fiction.\n\nFind something real to write about."
0,If  God was a Black Woman? Would the world be better place? yup lol
0,WATCH THIS VIDEO and tell me if you think it's BLASPHEMOUS? This is the link----- http://youtube.com/watch?v=bil4C3nH-CU a video can be blasphemous only if you believe in the god who is being dissed.\n\ni doubt anyone who worships kwalulu would find this footage disrespectful.
0,"Have you ever experienced paranormal activity..? Apart from meeting George W Bush....... I’m an amateur ghost hunter myself. It helps that I grew up around ghosts in my childhood home and in my Grandmother’s house. So, even though stuff would happen all the time, I was kind of used to it. Until my brother took it upon himself to explain to me what a ghost really was and I spent several months when I was 8 years old hiding under the blankets. Thanks for that, Bro. Now, I chase spirits and accidentally let a woman ghost into the house. Which my mother just loves me for..."
0,"how do you know if you are pschic? Does one jsut know their psychic? Is it genetic? Has anybody ever proved they are psychic? I wish there was a checklist or something that you could take to see you potential. I've known since I was a child that I special gifts.  I am more in tune with my surroundings and spirits of people who have gone before me.  It was something I grew up so I've always known.\n\nI think everyone has the abilities, but some do not recognize their own gifts and do not hone their skills."
0,"When did the image of Satan turn into the horned red devil holding the pitchfork? Was it always this way? Is that how he's described in the bible? Not that it matters, I was just curious. You mean he's not that way?\n\nbtw..I think that's one heck of a good question...smile"
0,"Would you invite a loner, someone you barely know, to Thanksgiving Dinner Tomorrow ?? We did. And now we're going to invite another. Sharing what we have with others feels so good, it's almost selfish. \n\nBesides your food, you'd be sharing your love. That is great!  It does feel so amazing to be kind to others, doesn't it?  Just be sure that you are doing it for the right reasons.  If you are only doing it so you can look good to others, then that is the wrong reason.  God bless you for your selflessness."
0,"What does mean ""teething troubles""? What does mean ""teething troubles""?\nand where comes from this word? Babies always have to suffer agony when they are cutting their first teeth.  It is to be expected that when a business first starts it is going to encounter problems, but these problems are then sorted out and soon forgotten, just like the pain suffered by the baby at that early stage of his life."
0,"do you think that the increase of pre-marital sex is the cause of the high divorce rate? if you look at countries where people don't have sex until marriage the divorce is lower but in countries like here in america.the divorce rate is 56% and many people in this country have sex outside of marriage. It all started when our morals went down the tubes - Thanks to Roe v Wade; We have been made into a culture of death; ie: Abortion; Euthanasia. When you are led down a path that tells you it is OK to kill the unborn, the innocent, well then pre marital sex is on the same path."
0,"If someone was to talk 'slang' to God...He would still answer their prayers, right? Hey, I'm jus curious k.\nNo rudeness, please.... I think it is wonderful to talk to God like a close friend.\n\nJesus even called God ""Abba"" which means ""Daddy"" or ""Papa.""\n\nWith love in Christ."
9,"how do i locate a inmate being transfered to a prison? my boyfriend was at a county jail and is now being transferred to a prison in california, how can i locate him? u would have to ask the cops"
