label	title	content
2	Brooke Valentine	 Kanesha Nichole Brookes (born October 5 1984) better known by her stage name Brooke Valentine is an American singer actress and model. Her single Girlfight peaked on U.S. music charts in 2005 paving the way for her debut album Chain Letter released via Subliminal Entertainment imprint on Virgin Records and went on to sell more than 290 000 units worldwide.
2	Carlos Cavazo	 Carlos Cavazo is a Mexican-born American guitarist best known as the guitarist for Quiet Riot during their commercial peak. Born July 8 1957 Cavazo is originally from Mexico City where his first band—of which his brother Antonio Cavazo was also a member—was called Speed of Light.
2	Olena Pchilka	 Olha Petrivna Kosach (29 June 1849 – 4 October 1930) better known by her pen name Olena Pchilka was a Ukrainian publisher writer ethnographer interpreter civil activist. Sister of Mykhailo Drahomanov. Mother of Lesya Ukrainka
2	Zhang Xiaotao	 Zhang Xiaotao was born in 1970 in Hechuan Chongqing China. He is a painter based in Beijing and Chengdu.He graduated from the Oil Painting Department of Sichuan Academy of Fine Arts [1] in 1996.He then became a teacher in the Southwest Jiaotong University Chengdu and this lasted from 1996-2009. In 2010 Xiaotao taught in the New Media Department of the Sichuan Fine Arts Institute.
2	Francis X. King	 Francis X. King (10 January 1934 – 8 November 1994) was a British occult writer and editor who wrote about tarot divination witchcraft magic sex magic tantra and holistic medicine. He was a member of the Society of the Inner Light an offshoot of the Alpha et Omega which in turn was an offshoot of the Hermetic Order of the Golden Dawn.
2	Alexis Cole	 Called one of the great voices of today Alexis Cole has been compared to classic jazz singers such as Sarah Vaughan and Anita O'Day. Her luxurious voice and innovative interpretations make her an instant favorite with audiences of all ages. Cole is the recipient of a Swing Journal Gold Disk award and has won the NY Jazzmobile and Montreux Jazz Festival vocal competitions. She records for Motéma Music NY. and Venus Records Japan.
2	Farhad Darya	 Farhad Darya Nashir (Pashto: فرهاد دریا‎; Persian: فرهاد دریا‎; born September 22 1962) is an Afghan singer composer and music producer. He serves as the United Nations Development Program (UNDP) National Goodwill Ambassador for Afghanistan and is involved in charitable organizations such as Music Village and others. He has earned affection for not only his music but also patriotism. He has a fan base that stretches from his native Afghanistan to parts of Central Asia Tajikistan and Iran.
2	Tony LaGundia	 Tony LaGundia is an American artist born in Grosse Pointe Michigan in 1971. When he was 28 years old he was injured in a ski accident shattering his right arm completely. He lost all function in the arm and was forced to find a career to accommodate his handicap. After working in bureaucratic jobs he began making art. LaGundia is credited with inventing leaky-edge abstraction whereby undiluted raw color shoots from within the edges of the rectangle rather than going beyond it.
2	Ronald Isley	 Ronald Isley (/ˈaɪzliː/; born May 21 1941) is an American recording artist songwriter record producer and occasional actor. Isley is better known as the lead singer and founding member of the family music group the Isley Brothers.
2	DJ Homicide	 Craig Anthony Bullock also known as DJ Homicide (December 17 1970) is the former DJ for rock band Sugar Ray.
2	Antonio Badile	 Antonio Badile (c. 1518 – 1560) was an Italian painter from Verona.
2	Juice Leskinen	 Juhani Juice Leskinen (former Pauli Matti Juhani Juice Leskinen) better known as Juice Leskinen (pronounced [ˈjuisɛ]  not like the English word juice; born 19 February 1950 in Juankoski – died 24 November 2006 in Tampere) was one of the most prominent Finnish singer-songwriters of the late 20th century. From the early 1970s onward he released nearly 30 full-length albums as well as writing song lyrics for dozens of Finnish artists.
2	Carlo Wolff	 Carlo Wolff is a prolific freelance journalist who writes for publications including The Boston Globe Chicago Sun-Times Pittsburgh Post-Gazette The Plain Dealer (Cleveland Ohio) and The Christian Science Monitor. He specializes in music criticism book reviews and feature articles about popular culture travel and business. He also specializes in reviewing graphic novels for the Globe.
2	Nicolas Fargues	 Nicolas Fargues (born 8 March 1972) is a French novelist.From 1998 to 2002 he had various jobs in journalism libraries and publishing. He published two novels Le Tour du propriétaire (2000) and Demain si vous le voulez bien (2001) before achieving his first major public and critical success with One Man Show published in 2002. This book is based on his own experiences in the media world where he encountered celebrities whom he found smaller and more tired than on the screen.
2	Gregg Foreman	 Gregg Foreman is an American musician and DJ born in Philadelphia Pennsylvania. Foreman gained recognition originally as the front man of The Delta 72 a band that channeled post punk rock sensibilities with 1960s British Invasion R&B to create a frenetic and honest style. His live gigs with The Delta 72 have been characterized by his onstage energetic performances and James Brown-like moves.
2	Jonnie Barnett	 Jonathan Barnett Kaye (1946 in Sumter South Carolina – August 18 2002) known professionally as Jonnie Barnett was an American musician. In the 1970s he performed as an opening act for several acts such as Tom Waits Cheech and Chong and Frank Zappa. He also made appearances in the 1975 film Nashville and in Cheech and Chong's Next Movie. One of Barnett's compositions One Foot in the Blues was recorded by Johnny Adams and received a Blues Song of the Year award from 1997 W. C.
11	Beatles for Sale	 Beatles for Sale is the fourth studio album by English rock band the Beatles released on 4 December 1964 and produced by George Martin for Parlophone. The album marked a minor turning point in the evolution of the Lennon–McCartney partnership John Lennon particularly now showing interest in composing songs of a more autobiographical nature.
11	Fistful of Metal	 Fistful of Metal is the debut album by American thrash metal band Anthrax released in January 1984 by Megaforce Records in the US and Music for Nations internationally. It includes a cover of Alice Cooper's I'm Eighteen. This is the band's only album to feature Neil Turbin on vocals and Dan Lilker on bass.
11	Things Here Are Different	 Things Here Are Different is the first album by American singer/songwriter Jill Sobule released in 1990. (see 1990 in music). It contained the singles Living Color and Too Cool to Fall in Love.
11	I Walk (album)	 I Walk is the 14th full-length album by German singer Herbert Grönemeyer released in October 2012. All songs on this album are sung in English. Ten of these songs are English reworks of previous works and three are newly written songs for this album.
11	29 Golden Bullets	 29 Golden Bullets is the third compilation by the German rock band Bonfire. It was released in 2001 by BMG International and features a bonus song that was cut from the Fireworks album called Take Me by the Hand. The album is a double CD that features the band's most recognized songs; some were remixed and others edited for radio airplay and all have been digitally remastered.
11	A Sure Thing	 A Sure Thing is an album by American trumpeter Blue Mitchell with orchestra recorded in late 1962 and released on the Riverside label.
11	Wichita Lineman (album)	 Wichita Lineman is the twelfth album by American singer-guitarist Glen Campbell released in 1968 by Capitol Records.
11	Antigone (album)	 Antigone is the third full-length album of the German metal band Heaven Shall Burn. The title was inspired by the female character of the play Antigone by Sophocles. The play is about a passionate young woman that does what she knows is right even though it is against the law. She makes sure that all of the town's people know what she did and she is punished by the king. The intro and the two outros were composed and recorded by Icelandic composer Ólafur Arnalds.
11	Gypsyhook EP	 Gypsyhook is the first solo release by Sonny Moore who would later use the alias Skrillex for future releases. It was recorded summer 2008 and was released on April 7 2009. On December 12 2008 Moore posted the track listing on his Myspace. The EP features three songs two of which he has posted demos for and four remixes. 海水 (Ocean Water) is a Japanese version of Mora.
11	Los K-Becillas	 Los K-Becillas (The Bosses in English) is a 2005 album by Master Joe & O.G. Black. Its the last album that Master Joe and OG Black work on because they broke up. It is the most successful album to date and peaked at 17 in Top Latin Albums.
11	Universal Syncopations	 Universal Syncopations is an album by Czech bassist Miroslav Vitous recorded in 2003 and released on the ECM label.
11	Playboys (The Rasmus album)	 For the band's song with the same name see Playboys (song).Playboys is the second studio album by the Finnish rock band The Rasmus (known as just Rasmus back then) which was released on August 29 1997 on Warner Music Finland.It went Gold in Finland and the single Blue also went Gold when it was released in May the same year. The album was not as popular outside their homeland Finland.Besides the band there were many additional musicians (see below) that appeared on Playboys.
11	Three Chord Opera	 Three Chord Opera is the twenty-fifth studio album by Neil Diamond. It was released by Columbia Records in 2001 and reached number 15 on the Billboard 200 chart. One song from the album You're the Best Part of Me reached number 28 on the Billboard Adult Contempary chart.
11	Season's Greetings from moe.	 Season's Greetings from moe. is a Christmas-themed album by the American jam band moe.When explaining the album on the band's official website moe. member Chuck Garvey wrote the following:
11	Past Present & Future	 Past Present & Future is a 2003 retrospective collection of the music of Rob Zombie. It includes selections of his work with White Zombie and his solo career as well as two previously unreleased tracks. It won a Metal Edge Readers' Choice Award for Compilation Album of the Year.The explicit version includes a bonus DVD with ten of Rob Zombie's/White Zombie's music videos; all are edited versions.
11	Automatic (Cognito album)	 Automatic is the debut studio album of American rapper Cognito released April 20 2010 with Strange Music. Since release the album has sold 1290 copies.[citation needed]
12	Popeye Meets the Man Who Hated Laughter	 Popeye Meets the Man Who Hated Laughter also known as The Man Who Hated Laughter is a 1972 American animated one-hour television movie that was part of The ABC Saturday Superstar Movie. This film is notable for uniting the characters from almost every newspaper comic strip then owned by King Features Syndicate in one story.
12	My Apocalypse (film)	 My Apocalypse (originally titled Quality Time) is a 2008 independent film starring Corin Nemec Bruce Weitz Nancy Allen John de Lancie Gail Strickland Meredith Salenger and Jesse Harper.Directed and produced by Chris LaMont the screenplay was written by LaMont Craig Belanger and Jay Holben.Although My Apocalypse was filmed in 1997 it was not released until 2008 which was due to the amount of funding that LaMont had available to him as an independent filmmaker.
12	Before the Deluge	 Before the Deluge (French: Avant le déluge) is a 1954 French drama film directed by André Cayatte. It was entered into the 1954 Cannes Film Festival.
12	The Terror Within II	 The Terror Within II is a 1991 science fiction/horror film starring Andrew Stevens who also directed it.
12	The Danger Mark	 The Danger Mark is a lost 1918 silent film directed by Hugh Ford and starring Elsie Ferguson. It was produced by Famous Players-Lasky and distributed by Paramount Pictures. It is based on a play by Robert W. Chambers.
12	Dhongee	 Dhongee is a 1979 Bollywood film directed by Ashok Roy. The film stars Randhir Kapoor Neetu Singh Asrani Prem Nath and in a special appearanceRakesh Roshan.
12	Hello Sister Goodbye Life	 Hello Sister Goodbye Life is a 2006 ABC Family original Dramedy television film based on novelist Claire Scovell LaZebnik's book Same as It Never Was. Starring Lacey Chabert as Olivia Wendie Malick as Barbara Adam Kaufman as Joe (Olivia's boyfriend) and last but not least the co-lead to Sammi Hanratty as Celia.
12	Faccia di spia	 Faccia di spia (also known as C.I.A. Secret Story) is a 1975 Italian political drama film written and directed by Giuseppe Ferrara.
12	Man of the Year (1971 film)	 Man of the Year (Italian: Homo Eroticus also known as Husband Italian Style) is a 1971 Italian commedia sexy all'italiana directed by Marco Vicario. The film was a blockbuster at the Italian box office.
12	Dead like Me: Life After Death	 Dead Like Me: Life After Death is a 2009 direct-to-video film directed by Stephen Herek. The film is based on the short-lived 2003 television series Dead Like Me created by Bryan Fuller.
12	Pune tc	 PUNE tc is a Hindi romantic comedy film directed by Abhijeet Choudhary(Director & Founder of Swatantra Theatre Pune). The movie is produced under Zoya & Saara Films.Eros International acquired the overseas rights of the film.
12	Rab Ne Bana Di Jodi	 Rab Ne Bana Di Jodi (Hindi: रब ने बना दी जोड़ी; translation: A Match Made by God) is a 2008 Indian romantic comedy film directed by Aditya Chopra and produced by Yash Raj Films. The film stars Shah Rukh Khan and movie debutant Anushka Sharma. Khan plays a mild-mannered office worker named Surinder Sahni whose love for the beautiful and vivacious Taani (Sharma) causes him to transform himself into the loud and fun-loving Raj to win her love.
12	Corporal Rod Webb (film series)	 Corporal Rod Webb and his faithful dog Chinook were the major characters in a series of films made by the American studio Monogram Pictures between 1949 and 1954.
12	Kavacham	 Kavacham is a 1992 Malayalam Indian film directed by K. Madhu starring Raghuvaran in lead role. The film was much expected as the action specialist director K. Madhu teamed with Raghuvaran who gave a hit in Malayalam Vyooham but this film flopped.
12	Lost Freedom	 Lost Freedom (Turkish: Kayıp Özgürlük) is a 2010 Turkish drama film written and directed by Umur Hozatlı about the relationship between the sister of a detained terror suspect and the son of the Turkish gendarmerie chief who has detained him. The film premiered out-of-competition at the 47th International Antalya Golden Orange Film Festival and was screened in-competition at the 22nd Ankara International Film Festival.
12	A Canção da Saudade	 'A Canção da Saudade' is a 1964 Portuguese black-and-white film. The filming took place in a studio at Tóbis Portuguesa Lisbon and Produções Cinematográficas Perdigão Queiroga. The film reel is 2630 m in length. A Spanish language film of the same story which shared the same producers and cast and crew members was made called Los gatos negros and directed by José Luis Monter.
5	Dassault Falcon 5X	 The Dassault Falcon 5X is a super mid-sized long-range business jet under development in France by Dassault Aviation.Even though its 5200 nmi (9630 km) range is not as high as that of the Falcon 7X the 5X has a larger fuselage diameter and greater cabin volume.The first flight is scheduled to take place in 2015 with an entry into service in 2017.
5	Vickers Vulcan	 The Vickers Vulcan was a British single-engine biplane airliner of the 1920s built by Vickers Limited at Brooklands Aerodrome Surrey. It carried eight passengers and a pilot.
5	HMS Shark (54S)	 HMS Shark was a Royal Navy S-class submarine which was launched on 31 May 1934 and fought in the Second World War. Shark is one of twelve boats named in the song Twelve Little S-Boats.She was surfaced whilst on patrol off Skudesnes southwest Norway on 5 July 1940 when a seaplane was sighted astern. As the submarine submerged she was bombed the explosions causing considerable damage.
5	HMS Moselle (1804)	 HMS Moselle was a Cruizer-class brig-sloop of the Royal Navy launched in 1804. She served during the Napoleonic Wars in the Mediterranean the Caribbean and the North American station. She was sold in 1815.
5	Spanish gunboat Callao	 Callao was a Samar-class gunboat of the Spanish Navy which served in the Spanish fleet from 1888 to 1898 and fought in the Spanish-American War.Callao was captured by the U.S. Navy in 1898 and commissioned into U.S. service. For her characteristics and career in U.S. service see USS Callao (YFB-11).
5	USS Hornet (1865)	 The USS Hornet (1865) was the fifth United States Navy ship to bear the name Hornet. She was originally the CSS Lady Stirling a blockade runner built by James Ash at Cubitt Town London in 1864 for the Confederate States Navy. She was badly damaged and captured by the United States Navy on 28 October 1864 off Wilmington North Carolina.
5	HMS Nonsuch (1646)	 HMS Nonsuch was a 34-gun fourth rate frigate of the English Royal Navy built by Peter Pett I at Woolwich and launched in 1646. The term 'frigate' during the period of this ship referred to a method of construction rather than a role which did not develop until the following century.Nonsuch was wrecked in 1664.
5	German submarine U-750	 German submarine U-750 was a German Type VIIC submarine U-boat built for Nazi Germany's Kriegsmarine for service during World War II.
5	Féré F.3	 The Féré F.3 is a single engine single seat French sports plane amateur designed and built in the 1980s. Only one was completed.
5	MV Great Expectations	 MV Great Expectations is a catamaran ferry operating on the Hythe ferry service. This service connects the town of Hythe and the city of Southampton across Southampton Water in England.MV Great Expectations was originally introduced in 1992 and was originally used on the Gravesend to Tilbury ferry service across the River Thames in Kent which was at that time operated by White Horse Ferries Ltd.
5	ROCS Ma Kong (DDG-1805)	 ROCS Ma Kong (馬公 DDG-1805) is a Kee Lung-class guided-missile destroyer currently in active service of Republic of China Navy. It is named after Ma Kong City Penghu Island a port city and the location of an important ROCN　base.She was formerly the American Kidd-class destroyer USS Chandler (DDG-996) which was decommissioned from the United States Navy in September 1999 and sold to the Republic of China Navy on 30 May 2003.
5	Ford Custom	 The Ford Custom is a car model name that has been used by the Ford Motor Company both in the United States and Canada from the 1930s to 1972.
5	Cornu helicopter	 The Cornu helicopter was an experimental helicopter built in France in 1907 and widely credited with the first free flight of a rotary-wing aircraft when it took to the air on 13 November. Built by bicycle-maker Paul Cornu it was an open-framework structure built around a curved steel tube that carried a rotor at either end and the engine and pilot in the middle. Power was transmitted to the rotors by a drive belt that linked both rotors and spun them in opposite directions.
5	Shenyang J-5	 The Shenyang J-5 (Chinese: 歼-5) originally designated Dongfeng-101 - (East Wind-101) and also Type 56 before being designated J-5 in 1964 is a Chinese-built single-seat jet interceptor and fighter aircraft derived from the Soviet Mikoyan-Gurevich MiG-17. The J-5 was exported as the F-5.
5	Imperator-class ocean liner	 The Imperator class ocean liners were a series of three ocean liners designed for the Hamburg America Line commonly known as HAPAG. These three ships were commissioned by the chairman of HAPAG Albert Ballin. Namely the Imperator (1912) the Vaterland (1913) and the largest the Bismarck (1914). These liners were over 50000 tons sported three funnels and had a length ranging from 906 ft (276 m) to 955.8 ft (291.3 m).
5	Polly Woodside	 Polly Woodside is a Belfast-built three-masted iron-hulled barque preserved in Melbourne Australia and forming the central feature of the South Wharf precinct. The ship was originally built in Belfast by William J. Woodside and was launched in 1885. Polly Woodside is typical of thousands of smaller iron barques built in the last days of sail intended for deep water trade around the world and designed to be operated as economically as possible.
13	Vi är inte ensamma	 Vi är inte ensamma - en samling berättelser om våra osynliga hjälpare in Swedish and Vi er ikke alene in Norwegian (in English We Are Not Alone - The Anthology Stories About Our Invisible Helpers; this book has not has been translated into English) is an occult nonfiction book published in 1990 written by Norwegian-Swedish author Margit Sandemo who is best known for her historical fantasy writing.
13	Driving Miss Daisy (play)	 Driving Miss Daisy is a 1987 play by Alfred Uhry about the relationship of an elderly white Southern Jewish woman Daisy Werthan and her black African-American chauffeur Hoke Colburn from 1948 to 1973. The play was the first in Uhry's Atlanta Trilogy which deals with white Jewish residents of that city in the early 20th century.
13	Top of the Pops (magazine)	 Top of the Pops magazine is a monthly publication published by Immediate Media Company. It features chart information star gossip fashion and beauty advice quizzes song lyrics and posters. It is a supplementary magazine for the TV show Top of the Pops until the latter was cancelled in 2006.The magazine was launched in February 1995 and is famous for giving girl group The Spice Girls their nicknames[citation needed].
13	Gândul	 Gândul (Romanian pronunciation: [ˈɡɨndul] The Thought) is a Romanian daily newspaper published in Bucharest. It was founded in May 2005 by Mircea Dinescu who used to write a daily editorial called Vorba lu' Dinescu and Cristian Tudor Popescu who was also the editor-in-chief until January 2008. Its initial circulation was about 52000. In 2006 Publimedia acquired Gândul and subsequently changed the format nameplate and design.
13	The Cardinal Sins	 The Cardinal Sins is a 1981 novel by author and priest Andrew Greeley.
13	Sharpe's Rifles (novel)	 Sharpe's Rifles was the first prequel novel in the series written by Bernard Cornwell. It tells the story of Richard Sharpe and the French Invasion of Galicia January 1809. Written ninth the book naturally fits before Sharpe's Eagle which was the first to be written although the later novel Sharpe's Havoc is set between the two.
13	Guardians of Ga'Hoole: The Journey	 The Journey is the second book in the Guardians of Ga'Hoole series. It is written by Kathryn Lasky and was published by Scholastic on September 1 2003. In this book Soren Gylfie Twilight Digger and Mrs. Plithiver continue their journey to the Great Ga'Hoole Tree where they will be tested beyond anything they have ever faced.
13	New York Journal-American	 The New York Journal-American was a newspaper published from 1937 to 1966. The Journal-American was the product of a merger between two New York newspapers owned by William Randolph Hearst: The New York American (originally the New York Journal renamed American in 1901) a morning paper and the New York Evening Journal an afternoon paper. Both were published by Hearst from 1895 to 1937. The American and Evening Journal merged in 1937. The Journal-American was an afternoon publication.
13	45 obrtaja: Priče o pesmama	 45 obrtaja: Priče o pesmama (Serbian Cyrillic: 45 обртаја: Приче о песмама trans. 45 Revolutions: Stories about Songs) is a book by Serbian rock musician journalist and writer Dejan Cukić. It was published in 2007 and compiled mostly from his articles previously published in Politikin Zabavnik magazine. The book features biographies of forty-five music artists as well as the history of popular music through stories about forty-five songs.
13	Fossil Hunter	 Fossil Hunter is a novel written by Canadian science fiction author Robert J. Sawyer. The sequel to Far-Seer it is the second book of the Quintaglio Ascension Trilogy. The book depicts an Earth-like world on a moon which orbits a gas giant inhabited by a species of highly evolved sentient Tyrannosaurs called Quintaglios among various other creatures from the late cretaceous period imported to this moon by aliens 65 million years prior to the story.
13	Mother Carey's Chickens (novel)	 Mother Carey's Chickens is a novel by Kate Douglas Wiggin published in 1911 by Houghton Mifflin. It tells the story of a poor but happy family of four children who in spite of being fatherless make the lives of others better. Their home life becomes complicated when Julia a snobbish cousin comes to live with them. The Carey children suffer many disappointments (Gilbert must forego college for example) but Julia is transformed when she realizes happiness has little to do with wealth.
13	Inkwell (journal)	 Inkwell is a literary journal published by Manhattanville College in Purchase New York. First published in 1995. The journal publishes short stories poetry and essays by both emerging and established writers. Inkwell also hosts annual contests in fiction and poetry.
13	Aelita (novel)	 Aelita (Russian: Аэлита) also known as Aelita or The Decline of Mars is a 1923 science fiction novel by Russian author Alexei Tolstoy.
13	Plain Tales from the Hills	 Plain Tales from the Hills (published 1888) is the first collection of short stories by Rudyard Kipling. Out of its 40 stories eight-and-twenty according to Kipling's Preface were initially published in the Civil and Military Gazette in Lahore Punjab British India between November 1886 and June 1887.
