label	title	content
6	Derby QUAD	 Derby QUAD also referred to as QUAD Derby or simply QUAD is an arts centre in Derby United Kingdom first opened on 26 September 2008. It has a steel and glass design by Bath architects Feilden Clegg Bradley. When it was chosen over competing designs by Derby council cabinet in 2004 it was considered controversial. QUAD provides an art gallery two cinemas artists’ studios and a cafe bar. The centre also has available spaces for people to create their own artwork.
6	Wasatch Stake Tabernacle	 The Wasatch Stake Tabernacle in Heber City Wasatch County Utah USA was completed in 1889 and served as a Latter Day Saints meetinghouse reserved for especially large congregations until 1965.
6	Anara Tower	 Anara Tower was a proposed supertall skyscraper located in Dubaiwhen. It would have been 600 m (1968 ft) tall with 135 floors. It was designed to look like a massive wind turbine. It was supposed to be a mixed use tower with offices retail spaces apartments and an art gallery. Anara Tower would have incorporated sky gardens every 27 floors and would have contained a luxury restaurant.
6	Kings Mall	 Kings Mall is a shopping centre in Hammersmith in the London Borough of Hammersmith and Fulham. The development is situated off King Street and was designed in the 1960s.
6	Rovde Church	 Rovde Church (Norwegian: Rovde kyrkje) is a parish church in Vanylven Municipality in Møre og Romsdal county Norway. It is located in the village of Rovdane along the Rovdefjorden. The church is part of the Rovde parish in the Søre Sunnmøre deanery in the Diocese of Møre. The white wooden church was built in 1872 by the architect Lars Tornæs. The church seats about 350 people. This is the third known church to stand on this site.
6	Kidd House (Lavonia Georgia)	 The Kidd House in Lavonia Georgia also known as Kidd Residence was built in 1919. It was designed by architect Leila Ross Wilburn. It was listed on the National Register of Historic Places in 1983.
6	Giddings-Burnham House	 The Giddings-Burnham House is a historic house at 37 Argilla Road in Ipswich Massachusetts. The house was probably built in the 1640s by George Giddings and was sold to his brother-in-law Thomas Burnham. The earliest documentation for this property was the deed of sale between George Giddings and Thomas Burnham in 1667 negating previous thoughts that the house was not built until 1680.
6	Middendorf's	 Middendorf's also known as Middendorf is a famous Louisiana seafood restaurant and a local institution.
6	Hackensack Water Company Complex	 The Hackensack Water Company developed water supply and storage in northeastern New Jersey during the latter part of 19th and the 20th century initially to provide service to the towns of North Hudson and the cities of Hoboken and Hackensack. Originally its headquarters and major facilities were located Hackensack. Under Robert W.
6	Bayshore Community Hospital	 Bayshore Community Hospital is a 225-bed acute care hospital located on a 37-acre (150000 m2) campus at 727 North Beers Street in Holmdel Township New Jersey United States. Its services include Cardiac Catheterization Diagnostic Imaging Medical/Surgical Behavioral Health Emergency Laboratory and Transitional Care. Bayshore Community Hospital is affiliated with The Meridian Health Family and The Cancer Institute of New Jersey.
6	University Medical Center Freiburg	 The University Medical Center Freiburg (Universitätsklinikum Freiburg) in Freiburg Germany is the teaching hospital and part of the medical research unit of the University of Freiburg and home to its Faculty of Medicine. The medical center is one of the largest and most reputable in Europe due to its extensive clinical capabilities and advances in research.
6	Deansboro Railroad Station	 The Deansboro Railroad Station is a late nineteenth century train depot in the hamlet of Deansboro in Oneida County New York. It is historically significant for its role in the history of railroads in New York State and for its related characteristic architecture.It was built by a predecessor railroad to the New York Ontario and Western Railway. The depot is a one story rectangular wood-frame building.
6	All Saints Roman Catholic Church (Buffalo New York)	 All Saints Roman Catholic Church is located at 127 Chadduck Ave Buffalo New York in the city's Riverside neighborhood.
6	Yavuz Selim Mosque	 The Yavuz Selim Mosque also known as the Selim I Mosque and the Yavuz Sultan Selim Mosque (Turkish: Yavuz Selim Camii) is an Ottoman imperial mosque located top of the 5th Hill of Istanbul Turkey overlooking the Golden Horn. Its size and geographic position make it a familiar landmark on the Istanbul skyline.
6	Fraser Octagon House	 Fraser Octagon House is an historic octagon house located at 63 Church Street in Tatamagouche Nova Scotia Canada. It was built in 1857 and is one and a half storeys.It features Greek Revival pilasters and entablature at the front entrance; a wood frame shed; and prominent location on a corner lot.It was recognized as a Nova Scotia Provincially Recognized Site under the Heritage Property Act on 31 March 1993.
6	Église Saint-Pothin	 The Église Saint-Pothin (English: Church of Saint Pothinus) is one of the religious buildings of Lyon on the left bank of the Rhône in the 6th arrondissement of Lyon on the Place Edgar Quinet. By order of 2 May 2007 the whole church was included in the supplementary inventory of monuments historiques.
10	Allantoma lineata	 Allantoma lineata (Portuguese common name: Seru) is a timber tree native from Brazil typical of Amazon Rainforest vegetation.
10	Cattleya crispata	 Cattleya crispata commonly known as Laelia flava is a species of orchid endemic to Minas Gerais Brazil. For registration purposes the Royal Horticultural Society calls this species Cattleya crispata.
10	Xylosma capillipes	 Xylosma capillipes is a species of plant in the Salicaceae family. It is endemic to New Caledonia.
10	Asteropeia	 Asteropeia may also refer to a figure in Greek mythology see AntinoeAsteropeia is a genus of flowering plants. The genus contains seven species of shrubs and small trees all native to Madagascar. It is the sole genus in family Asteropeiaceae. Members of the family are evergreen trees or shrubs.Members of the family were separated from the Theaceae based on wood anatomy by the APG system of 1998 and assigned to the order Caryophyllales in the clade core eudicots.
10	Thryptomene oligandra	 Thryptomene oligandra is a plant in the family Myrtaceae.
10	Alcea setosa	 Alcea setosa (Bristly Hollyhock) is an ornamental plant in the Malvaceae family.The Bristly Hollyhock is commonly found in the Mediterranean Basin the Galilee the Carmel the Gilboa Judea and Samaria. The part above ground of the plant withers and dies in the summer. In the winter a rosette of flowers develops and a vertical flowering stem grows out of it.
10	Aliciella	 Aliciella is a genus of plants in the phlox family. These plants have been treated as members of genus Gilia until recently when it was proposed they be moved back to Aliciella. This genus was created in 1905 to include certain gilias that seemed distinct from most of the others but it was abandoned soon after.
10	Hohenbergia rosea	 Hohenbergia rosea is a species of the genus Hohenbergia. This species is native to Brazil.
10	Adinandra integerrima	 Adinandra integerrima is a species of plant in the Theaceae family. It is found in Malaysia and Singapore. It is threatened by habitat loss.
10	Plectranthus cataractarum	 Plectranthus cataractarum is a species of flowering plant in the Lamiaceae family.It is found in Cameroon and Equatorial Guinea.Its natural habitats are subtropical or tropical moist lowland forests and rivers.It is threatened by habitat loss.
10	Fritillaria biflora	 Fritillaria biflora (Chocolate Lily mission bells) is a species of fritillary native to western California and northern Baja California. It occurs in the chaparral and woodlands ecoregion often in serpentine soil formations and hillside grassland habitats.Fritillaria biflora is a perennial herb up to 60 cm tall.
10	Cercestis	 Cercestis is a genus of flowering plants in the Araceae family that consists of 13 species. The species in this genus are all climbers and are endemic only to Africa. At intervals along the stem they produce long leafless shoots called flagella. Many of the species in Cersestis show signs of fenestration. The now defunct genus Rhektophyllum has since been sunk into Cercestis.
10	Nepenthes dubia	 Nepenthes dubia /nɨˈpɛnθiːz ˈduːbi.ə/ is a tropical pitcher plant endemic to Sumatra where it grows at an altitude of 1600–2700 m above sea level. The specific epithet dubia is the Latin word for doubtful.
10	Penaeaceae	 Penaeaceae is a family of evergreen leathery-leaved shrubs and small trees native to South Africa. The family has 29 species in nine genera. Penaeaceae was expanded under the APG III system of classification with the inclusion of the genera Olinia (formerly in the monogeneric Oliniaceae) and the single species from the genus Rhynchocalyx (formerly in the monogeneric Rhynchocalycaceae).
10	Penstemon digitalis	 Penstemon digitalis (foxglove beard-tongue or talus slope penstemon) is a plant in the plantain family Plantaginaceae. The flowers are white and are borne in summer. It is native to eastern Canada and eastern and southeastern United States.
10	Cucumis pubescens	 Cucumis pubescens is a wild variety of cucumber found in Rajasthan in India. It is frequently used as a meat tenderiser and is known by its local names kaachri kachri or sane. Its fruit which is eaten like a vegetable has a pungent flavour.
9	Rhabdochona papuanensis	 Rhabdochona papuanensis is a species of nematode parasite. It parasitises freshwater fishes from Papua New Guinea particularly Glossamia gjellerupi and Melanotaenia affinis.
9	Hyposmocoma eleuthera	 Hyposmocoma eleuthera is a species of moth of the Cosmopterigidae family. It is endemic to Hawaii. The type locality is Kilauea.
9	Polymitia eximipalpella	 Polymitia eximipalpella is a moth of the Gracillariidae family. It is known from Cyprus Turkey Israel Jordan Afghanistan Iran Iraq Saudi Arabia Syria Tajikistan Turkmenistan and Uzbekistan.
9	Asarta aethiopella	 Asarta aethiopella is a species of snout moths in the genus Asarta. It was described by Duponchel in 1837. It is found in France Spain Switzerland Italy Germany Austria Slovakia Bosnia and Herzegovina Albania the Republic of Macedonia Bulgaria Romania Ukraine and Russia.The wingspan is 14–16 mm.
9	Megacraspedus argyroneurellus	 Megacraspedus argyroneurellus is a moth of the Gelechiidae family. It is found in Russia (Lower Volga southern Ural) Ukraine (the Crimea) Central Asia the northern Caucasus and Turkey.
9	Opisthodon	 Opisthodon is a small genus of Limnodynastine frogs with only two species. Until a major revision in 2006 these two species were classified in the genus Limnodynastes but were removed to this resurrected genus to render monophyletic genera [1]. Both species are terrestrial and burrowing spend much times under ground particularly during drier periods. They inhabit a range of environments from arid areas to wet forest.
9	Super VC-10 Hap	 The Super VC-10 Hap (Placidochromis milomo) is a species of cichlid endemic to Lake Malawi along the Malawian shores of the lake. It prefers areas with rocky substrates. This species can reach a length of 18.7 centimetres (7.4 in) SL. It can also be found in the aquarium trade.It is an extremely thick-lipped species; its specific epithet milomo is the word for lips in the Chewa language.
9	Hypochrysops halyaetus	 Hypochrysops halyaetus is a member of the Lycaenidae family of butterflies.
9	Euchelus guttarosea	 Euchelus guttarosea is a species of sea snail a marine gastropod mollusk in the family Chilodontidae.
9	Acrolophus tapuja	 Acrolophus tapuja is a species of moths of the family Acrolophidae. It is found in Colombia and southern Brazil.
9	Barilius	 Barilius is a genus of cyprinid fishes native to Asia.
9	Etmopterus burgessi	 Etmopterus burgessi is a newly described lanternshark of the family Etmopteridae in the order Squaliformes. It is found only around Taiwan. Its expected common name would be Taiwan lanternshark.
9	Tripteridia caesiata	 Tripteridia caesiata is a moth in the Geometridae family. It is found in New Guinea.
9	Parnassius baileyi	 Bailey's Apollo Parnassius baileyi is a high altitude butterfly which is found in S.W. China (Sichuan northern Yunnan and eastern Tibet). It is a member of the Snow Apollo genus Parnassius of the Swallowtail (Papilionidae) family.The taxonomic status of this butterfly is uncertain. Parnassius baileyi was originally described as a subspecies of Parnassius acco later as a subspecies of P. rothschildianus Bryk 1931 and also P.
9	Thick-billed Saltator	 The Thick-billed Saltator (Saltator maxillosus) is a species of saltator in the Cardinalidae family. It is found in highland Atlantic Forest in southeastern Brazil far northeastern Argentina (only Misiones Province) and perhaps far eastern Paraguay. Unlike most other saltators it is sexually dichromatic: Females resemble a Green-winged Saltator but with a thicker bill greener face and buff throat.
9	Catocala atocala	 Brou's Underwing or Atocala Underwing (Catocala atocala) is a moth of the Noctuidae family. It is found from Louisiana west to Oklahoma and north to southern Illinois.Adults are on wing from July to August. There is probably one generation per year.The larvae feed on Juglans cinerea and Juglans nigra.
8	Tey 25 Pashahid Hoseyn Shahram Far	 Tey 25 Pashahid Hoseyn Shahram Far (Persian: تي 25 پشهيد حسين شهرام فر‎ also Romanized as Tey 25 Pashahīd Ḩoseyn Shahrām Far) is a village in Lahijan-e Sharqi Rural District Lajan District Piranshahr County West Azerbaijan Province Iran. At the 2006 census its population was 502 in 134 families.
8	Mahmudabad Borkhar	 Mahmudabad (Persian: محمود آباد‎ also Romanized as Maḩmūdābād) is a village in Borkhar-e Sharqi Rural District Habibabad District Borkhar County Isfahan Province Iran. At the 2006 census its existence was noted but its population was not reported.
8	Puzeh-ye Kuhbord	 Puzeh-ye Kuhbord (Persian: پوزه كوهبرد‎ also Romanized as Pūzeh-ye Kūhbord) is a village in Dehdasht-e Gharbi Rural District in the Central District of Kohgiluyeh County Kohgiluyeh and Boyer-Ahmad Province Iran. At the 2006 census its population was 86 in 14 families.
8	Tellow-e Bala	 Tellow-e Bala (Persian: تلوبالا‎ also Romanized as Tellow-e Bālā Talū Bālā and Tellow Bālā; also known as Tellow) is a village in Siyahrud Rural District in the Central District of Tehran County Tehran Province Iran. At the 2006 census its population was 23 in 14 families.
8	Lavegahau	 Lavegahau is a village in Wallis and Futuna. It is located in Mua District on the east coast of Wallis Island. Its population according to the 2008 census was 359 people.
8	Paju-Kurdla	 Paju-Kurdla is a village in Laimjala Parish Saare County in western Estonia.
8	Glūkas	 Glūkas is a village in Varėna district municipality in Alytus County in southeastern Lithuania. According to the 2001 census the village has a population of 4 people.
8	Tiri Estonia	 Tiri is a village in Lasva Parish Võru County in southeastern Estonia. It has a population of 12 and an area of 4.8 km².
8	Agricultural Pumps Complex	 Agricultural Pumps Complex (Persian: مجتمع تلمبه هائ كشاورزئ پشت سيل بند‎ – Mojtame` Tolombeh Hāy Keshāvarzy Pasht Seyl Band) is a village in Howmeh Rural District in the Central District of Andimeshk County Khuzestan Province Iran. At the 2006 census its population was 32 in 8 families.
8	Belenli Kahta	 Belenli is a village in the District of Kahta Adıyaman Province Turkey.
8	Chah-e Arabi	 Chah-e Arabi (Persian: چاه عربي‎ also Romanized as Chāh-e ‘Arabī and Chāh ‘Arabī; also known as Shāh ‘Arabī) is a village in Ziarat Rural District in the Central District of Dashtestan County Bushehr Province Iran. At the 2006 census its population was 106 in 24 families.
8	Jachadareha	 Jachadareha (Persian: جاچادرها‎ also Romanized as Jāchādarehā) is a village in Seyyedvaliyeddin Rural District Sardasht District Dezful County Khuzestan Province Iran. At the 2006 census its existence was noted but its population was not reported.
8	Tabaci	 Tabaci is a village in the municipality of Lukavac Bosnia and Herzegovina.
8	Mehdiabad Rigan	 Mehdiabad (Persian: مهدي اباد‎ also Romanized as 'Mehdīābād; also known as Mehdīābād-e ‘Āmerī) is a village in Rigan Rural District in the Central District of Rigan County Kerman Province Iran. At the 2006 census its population was 1014 in 234 families.
8	Jeleč (Hadžići)	 Jeleč (Hadžići) is a village in the municipality of Hadžići Bosnia and Herzegovina.
8	Jakubowice Opatów County	 Jakubowice [jakubɔˈvit͡sɛ] is a village in the administrative district of Gmina Ożarów within Opatów County Świętokrzyskie Voivodeship in south-central Poland. It lies approximately 9 kilometres (6 mi) south of Ożarów 18 km (11 mi) east of Opatów and 75 km (47 mi) east of the regional capital Kielce.The village has a population of 320.
