label	title	content
13	Conan the Relentless	 Conan the Relentless is a fantasy novel written by Roland Green featuring Robert E. Howard's sword and sorcery hero Conan the Barbarian. It was first published in paperback by Tor Books in April 1992 and was reprinted in April 1998.
13	Southeast Asia Building (magazine)	 Southeast Asia Building is a trade magazine based in Singapore started in 1974. It is published bi-monthly and covers architecture interior design landscape architecture and facility management. It caters to readers in Europe United States the Southeast Asian region and in the Middle East and provides information on current architecture projects building news product reviews market trends and industry related awards.
3	Gabriel Rivera	 Gabriel Rivera (born April 7 1961 in Crystal City Texas) is a former American college and professional football player who was a defensive tackle in the National Football League (NFL) for a single season in 1983. Rivera played college football for Texas Tech where he earned All-American honors in 1982. Rivera was a first round pick in the 1983 NFL Draft by the Pittsburgh Steelers.
3	Yvonne Tracy	 Yvonne Tracy (born 27 February 1981) is an Irish female international football defender. She is a well known player at the club and international level competing in youth cups beginning at age 16. She currently plays club football for Arsenal Ladies.
3	Vladimer Aptsiauri	 Vladimer Aptsiauri (4 February 1962 – 14 May 2012) was a Soviet fencer. He won a gold medal in the team foil event at the 1988 Summer Olympics.
3	David Carson (footballer)	 David Carson is a footballer playing for Ashington but has signed a contract with Blackburn Rovers.
3	Heath Bell	 Heath Justin Bell (born September 29 1977) is an American professional baseball relief pitcher for the Tampa Bay Rays of Major League Baseball (MLB). He previously played for the New York Mets San Diego Padres Miami Marlins and Arizona Diamondbacks. While playing with the Padres he was a three-time All-Star and twice won the Rolaids Relief Man Award.
3	Irma Hopper	 Irma Hopper (July 14 1890 – January 1963) was an American fencer. She competed in the women's individual foil events at the 1924 and 1928 Summer Olympics.
3	Atilio Ancheta	 Atilio Genaro Ancheta Weigel (born July 19 1948 in Florida Uruguay) is a former footballer from Uruguay who played for the national team at the 1970 FIFA World Cup. He was a defender and spent most of his career with Grêmio Football Porto-Alegrense appearing in 164 Campeonato Brasileiro Série A matches. In 1973 he received the Brazilian Bola de Ouro award.Ancheta made 20 appearances for the Uruguay national football team from 1969 to 1971.
3	Dušan Žovinec	 Dušan Žovinec (born October 5 1992) is a Czech professional ice hockey player. He played with HC Sparta Praha in the Czech Extraliga during the 2010–11 Czech Extraliga postseason.
3	Renato Ibarra	 Alex Renato Ibarra Mina (born 20 January 1991 in Ambuquí Imbabura) more commonly known as Renato Ibarra is an Ecuadorian football Winger who plays for Eredivisie club Vitesse and the Ecuadorian national team.
3	Alex Haddow	 Alex Haddow (born 8 January 1982) is an English footballer who plays as a left sided defender or midfielder. He played in the Football League for Reading and Carlise United before moving into non-league football following a serious knee injury.
3	Johnathan Aparecido da Silva	 Johnathan Aparecido da Silva commonly known as Johnathan (born 29 March 1990 in Fernandópolis) is a Brazilian footballer who plays as a striker for South Korean side Daegu FC.
3	Samu Vilkman	 Samu Vilkman is a Finnish ice hockey player who currently plays professionally in Finland for Tappara of the SM-liiga.
3	Jim Lawn	 James Jim Lawn (born 5 May 1902) was an Australian rules footballer who played with Collingwood in the Victorian Football League (VFL).Lawn was at Collingwood for three seasons. His final game for Collingwood was the 1925 VFL Grand Final which he played from a half forward flank. Collingwood lost to Geelong by 10 points.
3	Tommy Jammer	 Tommy Jammer is a retired American professional wrestler who competed in Midwest regional promotions including Pro Wrestling America and the American Wrestling Association in the late 1980s.
3	Neil McKinlay	 Neil McKinlay (born April 25 1981 in Langley British Columbia) was a Canadian football linebacker for the BC Lions of the Canadian Football League. He was drafted by the Winnipeg Blue Bombers with the 33rd pick in the fourth round of the 2004 CFL Draft. McKinlay announced his retirement after six seasons with the Bombers but was signed by the Lions after they had several players injured. He played CIS Football for Simon Fraser.As of 2012 is a firefighter with the Winnipeg Fire Department.
3	Masaaki Higashiguchi	 Masaaki Higashiguchi (東口 順昭 Higashiguchi Masaaki born 12 May 1986 in Osaka) is a Japanese footballer.Current he plays in Gamba Osaka.
4	Mark Blasdel	 Mark Blasdel is a Republican member of the Montana Legislature. He was elected to House District 10 which represents the Somers area. He has served in the 2007 2009 and 2011 legislative sessions. He is also the co-Chair of the Montana Sportsman Caucus.He graduated from Flathead High School then attended Flathead Valley Community College finishing his degree in Hospitality and Business Administration from the University of Nevada.
4	Bill Corr	 William V. Bill Corr is the Deputy Secretary of the United States Department of Health and Human Services (HHS) in President Barack Obama's administration.
4	Kojo Botsio	 Kojo Botsio (21 February 1916 – 5 February 2001) was a Ghanaian diplomat and politician. He studied in Britain where he became the treasurer of the West African National Secretariat and an acting warden for the West African Students' Union. He served as his country's foreign minister twice in the government of Kwame Nkrumah and was a leading figure in the ruling Convention People's Party (CPP).
4	Jacob Henry Miller	 Jacob Henry Miller was a lawyer from the U.S. State of Ohio who served as President of the Ohio State Senate.
4	Edwin Bideau	 Edwin 'Ed' H. Bideau III (October 1 1950 – September 5 2013) was a lawyer farmer rancher and Republican member of the Kansas House of Representatives representing the 9th district (Neosho County Kansas and Allen County Kansas).Bideau was a 5th generation Kansan who graduated from Chanute High School Neosho County Community College and then went on to get both a business and law degree from Washburn University in Topeka Kansas where he met and married his wife Margaret.
4	Keven Stratton	 Keven J. Stratton is an American politician and a Republican member of the Utah House of Representatives representing District 43 since January 1 2013. Stratton served consecutively from his April 28 2012 appointment to fill the vacancy caused by the resignation of Stephen Sandstrom until January 1 2013 in the District 58 seat. He lives in Orem.
4	Richard Doyle (politician)	 Richard (Dic) James Doyle OC (March 10 1923 – April 9 2003) was a Canadian journalist editor and Senator.Born in Toronto Ontario he served in the Royal Canadian Air Force during World War II and retired in 1945 with the rank of Flying Officer. He joined The Globe and Mail in 1951 becoming editor in 1963 and Editor-in-chief in 1978.
4	Bill Emmerson	 William Bill Emmerson (born October 28 1945) was a Republican California State Senator who represented the 23rd district in Riverside County. He previously represented the 37th Senate District having been elected in a June 8 2010 special election and sworn into office the next day. He was previously the California State Assemblyman representing District 63 in the Inland Empire counties of Riverside and San Bernardino having been first elected in November 2004.
4	Pat the Cope Gallagher	 Pat the Cope Gallagher (Irish: Pádraigh Ó Gallchóir Cope; born 10 March 1948) is an Irish Fianna Fáil politician. He is an ALDE Member of the European Parliament (MEP) for the North-West constituency having previously served as a Teachta Dála (TD) for the Donegal South–West constituency and as a junior minister.
4	Louis-Georges Desjardins	 Louis-Georges Desjardins (May 12 1849 – June 8 1928) was a Canadian journalist and politician.Born in Saint-Jean-Port-Joli Canada East the son of François Roy dit Desjardins and Clarisse Miville dit Deschênes Desjardins was educated at the Collège de Lévis and at the Military College. A journalist he was the editor-in-chief of the newspaper Le Canadien from 1875 to 1880.He was elected to the Legislative Assembly of Quebec for the electoral district of Montmorency in the 1881 election.
4	Guillaume Bresse	 Guillaume Bresse (February 2 1833 – January 30 1892) was a Canadian shoe manufacturer and politician.
4	Linda Chapa LaVia	 Linda Chapa LaVia is a Democratic member of the Illinois House of Representatives representing the 83rd District since 2003. The district covers part of Kane County including the city of Aurora.
4	Hu Chunhua	 Hu Chunhua (Chinese: 胡春华; pinyin: Hú Chūnhuá; born April 1963) is a prominent Chinese politician and regional official. He is the Communist Party Secretary of Guangdong province the province's top political office. He is a member of the 18th Politburo of the Communist Party of China. Hu has worked in Tibet for much of his political career and ascended the party ranks partly through the Communist Youth League. He is popularly known as little Hu.
4	Lisa Otondo	 Lisa Otondo is a state representative from Arizona representing the 4th district. A member of the Democratic Party Otondo was first elected to the Arizona House of Representatives in 2012. She serves on the Education Committee and the Technology and Infrastructure Committee.
4	Eugène Mangalaza	 Eugène Régis Mangalaza (born 13 July 1950) is a Malagasy political figure who was appointed as Prime Minister of Madagascar on 10 October 2009 under the terms of an agreement intended to resolve the 2009 political crisis.
4	Hu Sheng	 Hu Sheng (11 January 1918 – 5 November 2000) was a renowned Chinese Marxist theorist and historian. He was President of the Chinese Academy of Social Sciences from 1985 to 1998 and also served as vice-chairman of the 7th and 8th National Committees of the Chinese People's Political Consultative Conference (CPPCC) and member of the 12th Central Committee of the Communist Party of China.
0	Development Bank of Southern Africa	 The Development Bank of Southern Africa (DBSA) is a Development Finance Institution wholly owned by the government of South Africa and focuses on large infrastructure projects within the public and private sector. It is one of several development finance institutions in southern Africa. The main objectives are the promotion of economic development and growth human resource development institutional capacity building and the support of development projects in the region.
0	Flydubai	 Dubai Aviation Corporation (Arabic: مؤسسة دبي للطيران‎) trading as flydubai (Arabic: فلاي دبي‎ styled as flydubai) is a low-cost airline with its head office and flight operations in Terminal 2 of Dubai International Airport.The airline was established by the government of Dubai in July 2008. Although flydubai is not part of The Emirates Group Emirates supported flydubai during the initial establishing phase.
0	12 Tónar	 12 Tónar (Icelandic pronunciation: [ˈtʰoulv ˈtʰoːunar̥] twelve tones) is a small record shop in Reykjavík Iceland and also a record label for Icelandic indie bands. It is located on Skólavörðustígur 15 in downtown Reykjavík.Founded in 1998 in Reykjavík 12 Tónar has been well received by music lovers from the start.
0	GHA Coaches	 GHA Coaches is a bus and coach operator serving North East Wales.
0	Hansa-Brandenburg	 Hansa und Brandenburgische Flugzeugwerke (more usually just Hansa-Brandenburg) was a German aircraft manufacturing company that operated during World War I. It was created in May 1914 by the purchase of Brandenburgische Flugzeugwerke by Camillo Castiglioni who relocated the factory from Liebau to Brandenburg am Havel. Brandenburg's chief designer Ernst Heinkel was retained by the new enterprise.
0	Hrvatske ceste	 Hrvatske ceste (lit. Croatian roads) is a Croatian state-owned company pursuant to provisions of the Croatian Public Roads Act (Croatian: Zakon o javnim cestama enacted by the Parliament of the Republic of Croatia.Tasks of the company are defined by Public Roads Act and its Founding Declaration and the principal task of the company is management construction and maintenance of public roads.
0	KOAN (company)	 KOAN is an Italian company (also known as Koan Software) originally oriented in software for industrial automation since its founding in 1996 and subsequently specialized in embedded software. Currently it is mostly focusing on Embedded Linux distribution KaeilOS Linux device driver development embedded software consulting and Linux real time operating system integration with Xenomai and RTAI. KOAN head office are located in Bergamo Italy.
0	Brooks Brothers	 Brooks Brothers is the oldest men's clothier chain in the United States and is headquartered on Madison Avenue in Manhattan New York City. Founded in 1818 as a family business the privately owned company has been owned by Retail Brand Alliance since 2001 and now also features clothing for women.
0	Aliw Broadcasting Corporation	 Aliw Broadcasting Corporation one of the Philippines largest radio networks founded in 1991 with Home Radio and DWIZ as their flagship radio stations. The network is part of the ALC Group of Companies which also manages pre-need plans banking hotel operations retail mall operations property development and publishing operations.
0	Empresa Nacional de Energía Eléctrica	 The Empresa Nacional de Energía Eléctrica (also commonly known as ENEE) is Honduras's government owned and operated electrical power company operating within the Electricity sector in Honduras.
0	Nanaimo Regional Transit System	 Nanaimo Regional Transit System provides both conventional bus service and special needs paratransit services within the Regional District of Nanaimo in British Columbia Canada. The system operated by the Regional Transportation Services Department is jointly funded by BC Transit the provincial agency responsible for transit services outside of Metro Vancouver.
0	Bank PHB	 Bank PHB formerly known as Platinum Habib Bank is a commercial bank in Nigeria. The bank is the fifth largest financial services provider in Nigeria. The bank's assets are valued in excess of US$6 billion.
0	National CineMedia	 National CineMedia (NCM) operates NCM Media Networks an integrated media company reaching U.S. consumers in movie theaters online and through mobile technology.
0	Solar Energy World	 Solar Energy World is a solar energy company based out of Elkridge Maryland that installs solar panels and solar hot water systems in Delmarva. The company installed the SunPower system that powers the first ZeroHouse 2.0 on the East Coast in 2012. The original headquarters was located in Jessup Maryland but was moved to Elkridge in November 2010.
0	KACE Networks	 Dell KACE specializes in computer appliances for systems management of information technology equipment. They also provide software for security application virtualization and systems management products. Established in 2003 KACE is headquartered in Mountain View California with offices in Europe and Asia.
0	Russobit-M	 Russobit-M is one of the largest distributors of PC games in Russia and the CIS and is a key player in the PC game industry.Russobit-M was established in 1999 and immediately strived for success becoming the major publisher and distributor in the Russian and CIS game markets. The company now employs more than two hundred game specialists and has over one hundred partners worldwide. It has sold five million CD/DVDs on the local market.In 2003 the company combined efforts with GFI.
7	Crow Wing River	 The Crow Wing River is a 113-mile-long (182 km) tributary of the Mississippi River in Minnesota the United States. The river rises in a chain of 11 lakes in southern Hubbard County Minnesota and flows generally south then east entering the Mississippi at Crow Wing State Park northwest of Little Falls Minnesota. Its name is a loose translation from the Ojibwe language Gaagaagiwigwani-ziibi (Raven-feather River). A wing-shaped island at its mouth accounts for the river's name.
7	Summit Lake (Frontenac County)	 Summit Lake is a lake in the Madawaska Highlands in North Frontenac Frontenac County Ontario Canada about 3.5 kilometres (2.2 mi) northwest of the community of Ompah.
7	Monte Croce di Muggio	 Monte Croce di Muggio is a mountain of Lombardy in Italy with an elevation of 1799 m. It is located near Lake Como close to the city of Bellano.
7	Chalakudy River	 Chalakudy River or Chalakudy Puzha is the fourth longest river in Kerala India. The river flows through Palakkad district Thrissur District and Ernakulam District of Kerala. The total drainage area of the river is 1704 km². out of this 1404 km² lies in Kerala and the rest 300 km² in Tamil Nadu. The length of the river is 145.5 km.
7	Jabal al-Nour	 Jabal al-Nour (also Jabal an-Nur or Jabal Nur)which can be translated from Arabic(جبل النور)The Mountain of Light or Hill of Illuminationis a mountain near Mecca in Saudi Arabia's Hejaz region. It is one of the most popular tourist attractions in Mecca. The mountain houses the famed Ghar-E-Hira or Hira cave. The cave is quite small four arm's length long by 1.75 arm's length wide. The mountain is barely six hundred and forty meters tall.
7	Jabal al-Tair Island	 Jabal al-Tair Island (Jebel Teir Jabal al-Tayr Tair Island Al-Tair Island Jazirat at-Tair; Arabic: جزيرة جبل الطير‎ Jazīrat Jabal aṭ-Ṭayr literally Bird Mountain Island) is a roughly oval volcanic island northwest of the constricted Bab al-Mandab passage at the mouth of the Red Sea about half way between Yemen and Eritrea.
7	Ivanšćica	 Ivanšćica also sometimes spelled Ivanščica and Ivančica is a mountain in northern Croatia. The highest peak is the eponymous Ivanšćica at 1059 metres (3474 ft).The rivers of Bednja Lonja Krapina and Veliki potok rise and flow in the area.On March 16 1983 at 13:52:52 Ivanščica was the epicenter of a very strong (MCS VII) earthquake.
7	Keecheri River	 The Kechery River or Kechery Puzha is a west flowing river which has its origins at Machad hills in Thrissur District. The river is 51 kilometres in length and empties to Arabian Sea at Chettuva Lake. It is linked with backwaters at Enamaakkal. Choondal Thodu is the only tributary of this river. The river irrigates 3560 hectres of land in Thalapilly taluk on Thrissur District through Vazhani irrigation project.
7	Belinskij (crater)	 Belinskij (sometimes Belinskii) is a crater on Mercury. It has a diameter of 70 kilometers. Its name was adopted by the International Astronomical Union in 1985. Balzac is named for the Russian journalist and critic Vissarion Grigoryevich Belinsky who lived from 1811 to 1848.
7	Clear Lake (Iowa)	 Clear Lake is the name of a natural spring fed body of water located in Cerro Gordo County Iowa near Clear Lake Iowa. It is approximately 3684 acres (15 km2) in size. It is a popular fishing destination with walleye bullhead yellow bass and channel catfish. People from Des Moines and Minneapolis–Saint Paul have had homes on the shores of the lake since the 1870s. The average depth is 10 feet (3 m) and the maximum depth is 30 feet (9 m) in the dredged area of the west end.
7	Bannock Creek	 Bannock Creek is a 67-mile (110 km) long tributary of the Snake River in the U.S. state of Idaho. Beginning at an elevation of 5953 feet (1814 m) north of Holbrook in northern Oneida County it flows north into Power County and through the Arbon Valley the town of Pauline and the Fort Hall Indian Reservation.
7	Castor (mountain)	 Castor (Italian: Castore) is a mountain in the Pennine Alps on the border between Valais Switzerland and the Aosta Valley in Italy. It is the higher of a pair of twin peaks (Zwillinge) the other being Pollux named after the Gemini twins of Roman mythology. Castor's peak is at an elevation of 4228 m (13871 ft) and it lies between Breithorn and Monte Rosa.
7	Bratonea River	 The Bratonea River is a tributary of the Bistra Mărului River in Romania.
7	Mont Blanc de Courmayeur	 Mont Blanc de Courmayeur (Italian: Monte Bianco di Courmayeur) (4748 m) is a point on the south-east ridge of Mont Blanc that forms the peak of the massive south-east face of the mountain. It is connected to the main summit via the Col Major (c.
7	Tiefer See	 Tiefer See is a lake in the Mecklenburgische Seenplatte district in Mecklenburg-Vorpommern Germany. At an elevation of 62.9 m its surface area is 0.76 km².
7	Tyrrell Lake (Alberta)	 Tyrrell Lake is a lake in Alberta.
1	Kilkenny College	 Kilkenny College or KCK is a co-educational secondary school located in Kilkenny in the South-East of Ireland. It is a private school which caters for both boarders and day students. It is the largest co-educational boarding school in Ireland.
1	Digital Harbor High School	 Digital Harbor High School (originally known as Southern High School) is a public comprehensive magnet high school located in Baltimore Maryland. It is currently one of two secondary schools that specializes in information technology of Baltimore.
1	Fannin County High School	 Fannin County Comprehensive High School is located at 360 Rebel Circle in Blue Ridge Georgia. Fannin High offers a large array of classes and offers seven Advanced Placement classes including: English Literature English Language Biology Calculus Studio Art Art History European History United States History and Statistics.The current vision for the high school is to achieve 100% graduation with the class of 2015.
1	Snowflake High School	 Snowflake High School is one of the oldest schools in Arizona. It was founded in the late 19th century for the education of Snowflake’s youth. In 1888 the Snowflake Stake Academy was established to provide education beyond the 8th grade for all who cared to attend. It was initially established by the LDS Church as part of its Church Educational System.
1	Metrolina Regional Scholars' Academy	 Metrolina Regional Scholars' Academy (MRSA) is a charter school in Charlotte North Carolina. It was established in 2000 with the mission to provide appropriate education for highly gifted students in kindergarten through eighth grade. This school has earned several School of Excellence awards. It also earned a Blue Ribbon Award in 2011.
1	Royal School (Hawaii)	 The Royal School was a historic school founded in 1839 in Honolulu. Its original name was Chiefs' Children's School.
1	Brewster High School (Brewster New York)	 Brewster High School is a comprehensive public secondary school for grades 9 – 12 with an enrollment of approximately 1200 students and over 110 teachers and support personnel. Most students take English Social Studies Math and Science through their senior year.
1	Circle in the Square Theatre School	 Circle in the Square Theatre School is a non-profit tax exempt drama school associated with the Circle in the Square Theatre and as such is the only accredited school attached to a Broadway theatre.It offers two two-year programs: a Professional Acting Workshop and a Professional Musical Theatre Workshop.
1	Aarhus University School of Business and Social Sciences	 Aarhus University School of Business and Social Sciences The School of Business and Social Sciences (abbreviated BSS) is one of four main academic areas at Aarhus University located in the city of Aarhus Denmark.
1	Kendriya Vidyalaya Bolarum	 Kendriya Vidyalaya Bolarum (KVB Hindi: केन्द्रीय विद्यालय बोलारमसिकंदराबाद) is one of the reputed schools in Secunderabad city of Andhra Pradesh. It was started in the year 1980 then shifted to its new campus on 1993. The school is affiliated to the Central Board of Secondary Education New Delhi.
1	Federal University of Mato Grosso do Sul	 The Federal University of Mato Grosso do Sul (Portuguese: Universidade Federal de Mato Grosso do Sul) or UFMS is a public university located in the state of Mato Grosso do Sul in Brazil.
1	Youngpa girl's high school	 Youngpa Girl's High School(英波女子高等學校)is located in Seoul Songpa-gu Pungnab-dong General Private Girl's High School.
1	Stoneham High School	 Stoneham High School is a comprehensive four-year public school located in Stoneham Massachusetts that offers a range of Comprehensive to Advanced Placement Program courses. Accredited by the New England Association of Schools and Colleges its 71-member faculty has earned 55 Masters Degrees and has an average of 15 years of experience. As members of the Middlesex League Stoneham High School student-athletes compete in 20 varsity sports
1	Sydney Anglican Schools Corporation	 Sydney Anglican Schools Corporation website is an independent co-educational school system established by the Anglican Church Diocese of Sydney headquartered in Hurstville New South Wales Australia.The number of schools in the SASC group has increased from five in 1995 to 19 in 2012.
1	Immaculate Heart of Mary College-Parañaque	 Immaculate Heart of Mary College-Parañaque (IHMC-P formerly known as Immaculate Heart of Mary School-Parañaque; colloquially Imma) is a Private non-stock Roman Catholic educational institution run by the Franciscan Sisters of the Sacred Hearts. It is located on a 2.5 Hectare Lot along St. Dominic Savio Street in Better Living Subdivision Parañaque City.
1	Al Ameen School	 Al Ameen School is a British School located in Al Ghusais Dubai UAE. It is a private profit-making school. It has presently 500 students enrolled.
